business_name,category,rating,reviews,phone,whatsapp,full_address,district,taluka,city,maps_link,website,has_website,lead_score,premium_lead,branch_count,digital_presence,rejection_reason
Abhinav Computer Institute,Computer classes,,,9921384896,9921384896,"Shop no 2, sankalp appartment, near sbi bank, Yashoda nagar, Savedi, Ahilyanagar, Maharashtra 414003",Ahmednagar,,,https://www.google.com/maps/place/Abhinav+Computer+Institute/data=!4m7!3m6!1s0x3bdcbbb2dad4cf33:0x154d93eb534f0ea8!8m2!3d19.1274464!4d74.7414808!16s%2Fg%2F11sh4_jchn!19sChIJM8_U2rK73DsRqA5PU-uTTRU?authuser=0&hl=en&rclk=1,,no,65,no,1,none_found,outside target niche; rating below 4.2 or missing
Afinity Spocken English Classes,English academy,,,9423225020,9423225020,"juna Mahal, Shop no.2, Pavan Nagar, Bhistbag Rd, near Bhishtbagh, Savedi, Ahilyanagar, Maharashtra 414003",Ahmednagar,,,https://www.google.com/maps/place/Afinity+Spocken+English+Classes/data=!4m7!3m6!1s0x3bdcba5fc0c3ea69:0x3c8653b2d1927517!8m2!3d19.137657!4d74.731952!16s%2Fg%2F11s82yvxf2!19sChIJaerDwF-63DsRF3WS0bJThjw?authuser=0&hl=en&rclk=1,,no,65,no,1,none_found,outside target niche; rating below 4.2 or missing
Expert's Science Academy,Science academy,,,9422229997,9422229997,"47, Gulmohar Rd, Narhari Nagar, Savedi, Ahilyanagar, Maharashtra 414003",Ahmednagar,,,https://www.google.com/maps/place/Expert%27s+Science+Academy/data=!4m7!3m6!1s0x3bdcbbd7895a71c5:0x7b80df24db1fab7d!8m2!3d19.1212935!4d74.741733!16s%2Fg%2F11mnm_m2t7!19sChIJxXFaide73DsRfasf2yTfgHs?authuser=0&hl=en&rclk=1,,no,65,no,1,none_found,outside target niche; rating below 4.2 or missing
Galaxy Abacus Academy,Abacus classes,,,7057347128,7057347128,"4PGR GP7, Savedi, Ahilyanagar, Maharashtra 414003",Ahmednagar,,,https://www.google.com/maps/place/GALAXY+ABACUS+ACADEMY/data=!4m7!3m6!1s0x3bdcbb64d1b829cd:0xa697ddec98910048!8m2!3d19.1261224!4d74.7420068!16s%2Fg%2F11rm_z852j!19sChIJzSm40WS73DsRSACRmOzdl6Y?authuser=0&hl=en&rclk=1,,no,65,no,1,none_found,outside target niche; rating below 4.2 or missing
Inspire Abacus Classes And Vedic Maths,Abacus classes,,,9762035889,9762035889,"Renuka niwas, Bhutkarwadi Rd, Bhutkarwadi, Savedi, Ahilyanagar, Maharashtra 414003",Ahmednagar,,,https://www.google.com/maps/place/Inspire+Abacus+classes+and+vedic+maths/data=!4m7!3m6!1s0x3bdcbb92ae76f61d:0x9324aa88846cde1e!8m2!3d19.1131988!4d74.7284105!16s%2Fg%2F11yg15brmq!19sChIJHfZ2rpK73DsRHt5shIiqJJM?authuser=0&hl=en&rclk=1,,no,65,no,1,none_found,outside target niche; rating below 4.2 or missing
Mathematica Sci Academy,Aptitude classes,,,9511762005,9511762005,"H.No. 1515, Shriram Colony, Vijaynagar, Alamgir Rd, Bhingar, Nagardeole, Maharashtra 414002",Ahmednagar,,,https://www.google.com/maps/place/Mathematica+Sci+Academy/data=!4m7!3m6!1s0x3bdcb1bd3e78211f:0xc2c6e488ce1e13!8m2!3d19.09657!4d74.7783392!16s%2Fg%2F11rx3x09y6!19sChIJHyF4Pr2x3DsREx7OiOTGwgA?authuser=0&hl=en&rclk=1,,no,65,no,1,none_found,outside target niche; rating below 4.2 or missing
Novel Abacus Academy,Abacus classes,,,7588541302,7588541302,"Sriram Towers, opp. Jogging track, behind abhinav Urban Bank, Professor Colony, Savedi, Ahilyanagar, Maharashtra 414003",Ahmednagar,,,https://www.google.com/maps/place/NOVEL+ABACUS+ACADEMY/data=!4m7!3m6!1s0x3bdcbb105d1540cd:0xf3fa6e1140a4e9f9!8m2!3d19.1192623!4d74.7366498!16s%2Fg%2F11h1qsrhq6!19sChIJzUAVXRC73DsR-emkQBFu-vM?authuser=0&hl=en&rclk=1,,no,65,no,1,none_found,outside target niche; rating below 4.2 or missing
Shri Coaching And Abacus Classes,Abacus classes,,,7057055312,7057055312,"Nagar-Kalyan Rd, near Jadhav Petrol station, behind Haral Hospital, Nepti Suburban, Ahilyanagar, Maharashtra 414001",Ahmednagar,,,https://www.google.com/maps/place/Shri+Coaching+and+Abacus+Classes/data=!4m7!3m6!1s0x3bdcb1ed77509975:0xef3f5dac9106b3c1!8m2!3d19.0979752!4d74.724046!16s%2Fg%2F11y1y943kq!19sChIJdZlQd-2x3DsRwbMGkaxdP-8?authuser=0&hl=en&rclk=1,,no,65,no,1,none_found,outside target niche; rating below 4.2 or missing
Success Science Academy,Science academy,,,7507208474,7507208474,"Nepti Rd, Jagdamba Colony, Eknathnagar, Kedgaon, Ahilyanagar, Maharashtra 414005",Ahmednagar,,,https://www.google.com/maps/place/Success+Science+Academy/data=!4m7!3m6!1s0x3bdcb1f992c43c69:0xa66c65621f0781ca!8m2!3d19.0694613!4d74.6992088!16s%2Fg%2F11ycjylh7g!19sChIJaTzEkvmx3DsRyoEHH2JlbKY?authuser=0&hl=en&rclk=1,,no,65,no,1,none_found,outside target niche; rating below 4.2 or missing
Vision Coaching & Abacus Classes,Abacus classes,,,7021524194,7021524194,"near Inamdar Floor Mill, Gajanan Colony, Navnagapur, MIDC, Nagapur, Maharashtra 414111",Ahmednagar,,,https://www.google.com/maps/place/Vision+Coaching+%26+Abacus+Classes/data=!4m7!3m6!1s0x3bdcbbeb44b3a0bb:0x7c1994acdf822bd!8m2!3d19.1585369!4d74.7056515!16s%2Fg%2F11t7j7_vmc!19sChIJu6CzROu73DsRvSL4zUqZwQc?authuser=0&hl=en&rclk=1,,no,65,no,1,none_found,outside target niche; rating below 4.2 or missing
Jain Coaching Classes,1st to 12th classes,3.6,5,,,"5, Gulmohar Rd, Savedi, Ahilyanagar, Maharashtra 414003",Ahmednagar,,,https://www.google.com/maps/place/Jain+Coaching+Classes/data=!4m7!3m6!1s0x3bdcba84ef0586b9:0xfddc581e71665046!8m2!3d19.1219647!4d74.7434322!16s%2Fg%2F11g88v32qq!19sChIJuYYF74S63DsRRlBmcR5Y3P0?authuser=0&hl=en&rclk=1,,no,62,no,1,none_found,missing valid mobile or WhatsApp; rating below 4.2 or missing
Bansod's Classes,1st to 12th classes,,,,,"yashodanagar, bansal classes, GP tower, plot no 5, Pipeline Rd, Savedi, Ahilyanagar, Maharashtra 414003",Ahmednagar,,,https://www.google.com/maps/place/Bansod%27s+classes/data=!4m7!3m6!1s0x3bdcbb00790577e5:0x1001b8e1cbcb5f21!8m2!3d19.1274791!4d74.7412637!16s%2Fg%2F11z1t4clgw!19sChIJ5XcFeQC73DsRIV_Ly-G4ARA?authuser=0&hl=en&rclk=1,,no,62,no,1,none_found,missing valid mobile or WhatsApp; rating below 4.2 or missing
Navodaya Coaching Institute,SSC coaching,,,,,"CRISTLE BUILDING, Jamkhed Rd, near Damaniya Bungalow, General Vaidya Colony, Camp, Darewadi, Maharashtra 414002",Ahmednagar,,,https://www.google.com/maps/place/Navodaya+Coaching+Institute/data=!4m7!3m6!1s0x3bdcb02eb3f5ee51:0xdcd5847bf4748e2b!8m2!3d19.0773083!4d74.774375!16s%2Fg%2F11xrlr4_wq!19sChIJUe71sy6w3DsRK4509HuE1dw?authuser=0&hl=en&rclk=1,,no,62,no,1,none_found,missing valid mobile or WhatsApp; rating below 4.2 or missing
Satyabhama Spoken English Academy,English academy,,,,,"Sadaguru Shankar Maharaja Nager Ganesh nagar , Kalyan, road, Nagar, Maharashtra 414001",Ahmednagar,,,https://www.google.com/maps/place/Satyabhama+Spoken+English+Academy/data=!4m7!3m6!1s0x3bdcb1947dde2db1:0xc71fc1cc84205fb5!8m2!3d19.1023814!4d74.7092456!16s%2Fg%2F11txd_rnhn!19sChIJsS3efZSx3DsRtV8ghMzBH8c?authuser=0&hl=en&rclk=1,,no,62,no,1,none_found,missing valid mobile or WhatsApp; rating below 4.2 or missing
Inspire Abacus Class,Abacus classes,5.0,1,,,"Guruvarya Niwas, Shivshakti Park, Kalamkar Nagar, Bolhegaon Suburban, Nagapur, Maharashtra 414111",Ahmednagar,,,https://www.google.com/maps/place/Inspire+Abacus+Class/data=!4m7!3m6!1s0x3bdcbb005e6639d3:0x68ba5f93355628db!8m2!3d19.1286434!4d74.7135091!16s%2Fg%2F11vr9t51bl!19sChIJ0zlmXgC73DsR2yhWNZNfumg?authuser=0&hl=en&rclk=1,,no,60,no,1,none_found,missing valid mobile or WhatsApp; outside target niche
Stock Market Class In Ahmednagar,Banking coaching,5.0,16,,,"Bagh Rouza, Nuevo, Ahilyanagar, Maharashtra 414001",Ahmednagar,,,https://www.google.com/maps/place/STOCK+MARKET+CLASS+IN+Ahmednagar/data=!4m7!3m6!1s0x3bdcb1c601820ff1:0xeeec0a5edef606b7!8m2!3d19.0971597!4d74.7299917!16s%2Fg%2F11h07ybblt!19sChIJ8Q-CAcax3DsRtwb23l4K7O4?authuser=0&hl=en&rclk=1,,no,60,no,1,none_found,missing valid mobile or WhatsApp; outside target niche
Excel Computers,Computer classes,4.2,14,,,"3PJP HG8, Nandanvan Colony, Bhavani Nagar, Ahilyanagar, Maharashtra 414001",Ahmednagar,,,https://www.google.com/maps/place/Excel+computers/data=!4m7!3m6!1s0x3bdcb058552ce7d1:0x72d40d21a84a5ba2!8m2!3d19.081423!4d74.736332!16s%2Fg%2F1263b_vbx!19sChIJ0ecsVViw3DsRoltKqCEN1HI?authuser=0&hl=en&rclk=1,,no,60,no,1,none_found,missing valid mobile or WhatsApp; outside target niche
Lao Army Ahmednagar,Army coaching,4.2,5,,,"4P2W CPP, Unnamed Road, Mukundnagar, Ahilyanagar, Maharashtra 414001",Ahmednagar,,,https://www.google.com/maps/place/LAO+Army+Ahmednagar/data=!4m7!3m6!1s0x3bdcb18863483315:0x3c5212a78203520e!8m2!3d19.1010779!4d74.7468426!16s%2Fg%2F11lbgf43j1!19sChIJFTNIY4ix3DsRDlIDgqcSUjw?authuser=0&hl=en&rclk=1,,no,60,no,1,none_found,missing valid mobile or WhatsApp; outside target niche
Sankalp Education,Banking coaching,4.1,16,8975830101,8975830101,"2nd Floor Punjab National Bank Laal Taki, Road, Ahilyanagar, Maharashtra 414001",Ahmednagar,,,https://www.google.com/maps/place/Sankalp+Education/data=!4m7!3m6!1s0x3bdcb07cfbf90dbd:0x96124477c85594ba!8m2!3d19.104602!4d74.7369667!16s%2Fg%2F11ggdvdtd1!19sChIJvQ35-3yw3DsRupRVyHdEEpY?authuser=0&hl=en&rclk=1,,no,60,no,1,none_found,outside target niche; rating below 4.2 or missing
Suman I Talent,Railway coaching,3.9,213,,,"3PJM CQ4, Anand Colony, Next to Ankur Lawn, Anand Rishiji, Hospital Rd, Ahilyanagar, Maharashtra 414001",Ahmednagar,,,https://www.google.com/maps/place/Suman+I+Talent/data=!4m7!3m6!1s0x3bdcb183cb2254b1:0xf0026a2a9e7562f5!8m2!3d19.0810085!4d74.7344435!16s%2Fg%2F11fky_srr1!19sChIJsVQiy4Ox3DsR9WJ1nipqAvA?authuser=0&hl=en&rclk=1,,no,60,no,1,none_found,missing valid mobile or WhatsApp; outside target niche; rating below 4.2 or missing
Meera Computers,Computer classes,2.8,8,9960786024,9960786024,"Gauravnagar, near HOLY ANGELS SCHOOL, Mukundnagar, Ahilyanagar, Maharashtra 414001",Ahmednagar,,,https://www.google.com/maps/place/Meera+Computers/data=!4m7!3m6!1s0x3bdcb073fdb9eaf1:0x18b4b683df7ec342!8m2!3d19.1099474!4d74.7478656!16s%2Fg%2F11b7m97f2d!19sChIJ8eq5_XOw3DsRQsN-34O2tBg?authuser=0&hl=en&rclk=1,,no,60,no,1,none_found,outside target niche; rating below 4.2 or missing
Dnyansampada School English Medium,English academy,,,7447485422,7447485422,"4PRG CHR, Tapovan Rd, Savedi, Ahilyanagar, Maharashtra 414003",Ahmednagar,,,https://www.google.com/maps/place/Dnyansampada+School+%28English+Medium%29/data=!4m7!3m6!1s0x3bdcbaeb385480cb:0x9087b47b0d849f6b!8m2!3d19.141116!4d74.726397!16s%2Fg%2F11c3w030h4!19sChIJy4BUOOu63DsRa5-EDXu0h5A?authuser=0&hl=en&rclk=1,,no,60,no,1,none_found,outside target niche; rating below 4.2 or missing
Mahaveer Science Academy,NEET coaching,,,,,"Parijat Colony, in front of Poddar International School, Kotkar Nagar, Kedgaon, Ahilyanagar, Maharashtra 414005",Ahmednagar,,,"https://www.google.com/maps/place/MAHAVEER+SCIENCE+ACADEMY+JEE,+NEET,+MHTCET,+KVPY,+BITSET,+FOUNDATION+8TH+TO+10TH+AND+REGULAR+BOARD+11TH+AND+12TH/data=!4m7!3m6!1s0x3bdcb172070243f3:0x8dab1ee1ef90ceb7!8m2!3d19.0774835!4d74.7048933!16s%2Fg%2F11wwwhn61x!19sChIJ80MCB3Kx3DsRt86Q7-Eeq40?authuser=0&hl=en&rclk=1",,no,60,no,1,none_found,missing valid mobile or WhatsApp; rating below 4.2 or missing
I Genius Abacus Academy India Pvt Ltd . Wakodi Phata Ahilyanagar,Abacus classes,,,9921290907,9921290907,"Hanuman temple, Wakodi Phata, Wakodi, Maharashtra 414002",Ahmednagar,,,"https://www.google.com/maps/place/I-Genius+Abacus+Academy,+India+Pvt+Ltd+.+Wakodi+Phata,+Ahilyanagar/data=!4m7!3m6!1s0x3bdcb10237840f03:0xddf6c94aa8fb38f5!8m2!3d19.0663726!4d74.7600495!16s%2Fg%2F11lzwv0qzy!19sChIJAw-ENwKx3DsR9Tj7qErJ9t0?authuser=0&hl=en&rclk=1",,no,55,no,1,none_found,outside target niche; rating below 4.2 or missing
Bts Coaching Center Bridge To Success,NEET coaching,5.0,63,7020727471,7020727471,"3D Corner, Tapovan Rd, opposite darandale hospital, Surya Nagar, Burhanagar, Maharashtra 414003",Ahmednagar,,,https://www.google.com/maps/place/BTS+Coaching+center+%28BRIDGE+TO+SUCCESS%29/data=!4m7!3m6!1s0x3bdcbb188500f7a1:0x1916a95eb98de75f!8m2!3d19.1388343!4d74.7557919!16s%2Fg%2F11xnctml92!19sChIJofcAhRi73DsRX-eNuV6pFhk?authuser=0&hl=en&rclk=1,https://spage.in,yes,50,no,2,website,has website
Join Guerriers Group,NDA coaching,4.5,2,,,"Priyadarshani Public School, Ahmednagar - Pathardi Rd, Bhingar, Maharashtra 414002",Ahmednagar,,,https://www.google.com/maps/place/JOIN+GUERRIERS+GROUP+-+NDA+CDS+AFCAT+SSB_INTERVIEW+GD+ARMY+NAVY+AIRFORCE/data=!4m7!3m6!1s0x3bdcaf8f6c43e9c3:0x871de52acca12d2d!8m2!3d19.0952288!4d74.7846787!16s%2Fg%2F11gp5xbnks!19sChIJw-lDbI-v3DsRLS2hzCrlHYc?authuser=0&hl=en&rclk=1,,no,50,no,1,none_found,missing valid mobile or WhatsApp; outside target niche
Dbpa Desarda Bhandari Professional Academy,Banking coaching,4.1,14,,,"4PGM 463, Kings Rd, Sona Nagar, Savedi, Ahilyanagar, Maharashtra 414003",Ahmednagar,,,https://www.google.com/maps/place/DBPA+Desarda+Bhandari+Professional+Academy/data=!4m7!3m6!1s0x3bdcba62ae4604af:0xfac895186224bb4b!8m2!3d19.1252694!4d74.733058!16s%2Fg%2F11f3g4xl64!19sChIJrwRGrmK63DsRS7skYhiVyPo?authuser=0&hl=en&rclk=1,,no,50,no,1,none_found,missing valid mobile or WhatsApp; outside target niche; rating below 4.2 or missing
Mhaske Coching Classes,Tuition classes,4.0,1,,,"near government D. Ed college, Sudke Mala, Ahilyanagar, Maharashtra 414001",Ahmednagar,,,https://www.google.com/maps/place/Mhaske+coching+classes/data=!4m7!3m6!1s0x3bdcb1e736d506b3:0xe26a48e2b4478f26!8m2!3d19.0982985!4d74.7317326!16s%2Fg%2F11v5g1gymj!19sChIJswbVNuex3DsRJo9HtOJIauI?authuser=0&hl=en&rclk=1,,no,50,no,1,none_found,missing valid mobile or WhatsApp; outside target niche; rating below 4.2 or missing
Novel Abacus Academy,Abacus classes,3.8,4,,,"police colony, Adhishakti Apartment, 16-B, Pipeline Rd, Dnyaneshwar Nagar, Ahilyanagar, Maharashtra 414003",Ahmednagar,,,https://www.google.com/maps/place/NOVEL+Abacus+Academy/data=!4m7!3m6!1s0x3bdcbb6175bca16d:0x107b7dd9a2255481!8m2!3d19.1287228!4d74.7368044!16s%2Fg%2F11v3h08ky3!19sChIJbaG8dWG73DsRgVQlotl9exA?authuser=0&hl=en&rclk=1,,no,50,no,1,none_found,missing valid mobile or WhatsApp; outside target niche; rating below 4.2 or missing
Soumya Classes And Perfect Abacus Class,Abacus classes,3.0,2,,,"MIDC, Nagapur, Maharashtra 414111",Ahmednagar,,,https://www.google.com/maps/place/Soumya+classes+and+perfect+abacus+class/data=!4m7!3m6!1s0x3bdcbbdb78367e37:0xf50b1dd2a72925eb!8m2!3d19.1551678!4d74.7105976!16s%2Fg%2F11srzxs4w8!19sChIJN342eNu73DsR6yUpp9IdC_U?authuser=0&hl=en&rclk=1,,no,50,no,1,none_found,missing valid mobile or WhatsApp; outside target niche; rating below 4.2 or missing
Vijay Computer Typing Institute,Computer classes,2.0,1,,,"Vasant Tekdi, VIR SAVARKAR MARG, Savedi, Ahilyanagar, Maharashtra 414003",Ahmednagar,,,https://www.google.com/maps/place/Vijay+Computer+Typing+Institute/data=!4m7!3m6!1s0x3bdcbbc6a21b3037:0x7042c0f1ad57aa59!8m2!3d19.1215819!4d74.7482944!16s%2Fg%2F11fk0qt54m!19sChIJNzAbosa73DsRWapXrfHAQnA?authuser=0&hl=en&rclk=1,,no,50,no,1,none_found,missing valid mobile or WhatsApp; outside target niche; rating below 4.2 or missing
Shatrujeet Academy,NDA coaching,1.0,1,,,"4PGV QM4, Dnyaneshwar Nagar, Ahilyanagar, Maharashtra 414003",Ahmednagar,,,https://www.google.com/maps/place/Shatrujeet+Academy+NDA+CDS+SSB+Coaching+in+Ahmednagar/data=!4m7!3m6!1s0x3bdcbb0070858a3d:0xe41aed98e43b6f54!8m2!3d19.126847!4d74.744238!16s%2Fg%2F11y660gf7l!19sChIJPYqFcAC73DsRVG875JjtGuQ?authuser=0&hl=en&rclk=1,,no,50,no,1,none_found,missing valid mobile or WhatsApp; outside target niche; rating below 4.2 or missing
Active Metro Brain Abacus Classes,Abacus classes,,,,,"Pipeline Rd, Gawade Mala, Bhistabag, Ahilyanagar, Maharashtra 414003",Ahmednagar,,,https://www.google.com/maps/place/Active+Metro+Brain+Abacus+Classes/data=!4m7!3m6!1s0x3bdcbb0efcf2dc33:0x17b55991b5adcac2!8m2!3d19.1299617!4d74.7382498!16s%2Fg%2F11mlq0g1vk!19sChIJM9zy_A673DsRwsqttZFZtRc?authuser=0&hl=en&rclk=1,,no,50,no,1,none_found,missing valid mobile or WhatsApp; outside target niche; rating below 4.2 or missing
Everest Abacus Classes,Abacus classes,,,,,"Londhe Mala, Sonewadi Road, Kedgaon, Ahilyanagar, Maharashtra 414005",Ahmednagar,,,https://www.google.com/maps/place/Everest+Abacus+Classes/data=!4m7!3m6!1s0x3bdcb10028c5dd71:0xd06f2618fd3a6895!8m2!3d19.0519282!4d74.7031594!16s%2Fg%2F11z6792rtf!19sChIJcd3FKACx3DsRlWg6_Rgmb9A?authuser=0&hl=en&rclk=1,,no,50,no,1,none_found,missing valid mobile or WhatsApp; outside target niche; rating below 4.2 or missing
Evrest Abacus Classes,Abacus classes,,,,,"26, Tapovan Rd, Ashwini Colony, Burhan Nagar, Burhanagar, Maharashtra 414003",Ahmednagar,,,https://www.google.com/maps/place/EVREST+ABACUS+CLASSES/data=!4m7!3m6!1s0x3bdcbbdee8da9ca5:0x1fb2ab8c327dd21e!8m2!3d19.1421676!4d74.7534673!16s%2Fg%2F11t_spnrx3!19sChIJpZza6N673DsRHtJ9Moyrsh8?authuser=0&hl=en&rclk=1,,no,50,no,1,none_found,missing valid mobile or WhatsApp; outside target niche; rating below 4.2 or missing
Excellence Science Academy,Science academy,,,,,"4PFJ QF4, Sona Nagar, Prashantnagar, Savedi, Ahilyanagar, Maharashtra 414003",Ahmednagar,,,https://www.google.com/maps/place/Excellence+Science+Academy/data=!4m7!3m6!1s0x3bdcbb000e935c77:0xb12162eed358ad8c!8m2!3d19.124381!4d74.7311976!16s%2Fg%2F11z73qg87k!19sChIJd1yTDgC73DsRjK1Y0-5iIbE?authuser=0&hl=en&rclk=1,,no,50,no,1,none_found,missing valid mobile or WhatsApp; outside target niche; rating below 4.2 or missing
Inspair Abacus Classes,Abacus classes,,,,,"3QVR 7HW, Ahilyanagar - Beed Rd, Maheshnagar, Bhingar, Maharashtra 414002",Ahmednagar,,,https://www.google.com/maps/place/INSPAIR+ABACUS+CLASSES/data=!4m7!3m6!1s0x3bdcafdb2fa73b9d:0x4956c874f2790938!8m2!3d19.0932422!4d74.7914499!16s%2Fg%2F11tcjrtj_g!19sChIJnTunL9uv3DsROAl58nTIVkk?authuser=0&hl=en&rclk=1,,no,50,no,1,none_found,missing valid mobile or WhatsApp; outside target niche; rating below 4.2 or missing
Inspire Abacus Academy,Mathematics classes,,,,,"Om Colony, Nandanvan Nagar, near Dnyansampada English Medium School, Savedi, Ahilyanagar, Maharashtra 414003",Ahmednagar,,,https://www.google.com/maps/place/Inspire+Abacus+Academy/data=!4m7!3m6!1s0x3bdcbb2f430e5617:0x96b93a714293106!8m2!3d19.1388689!4d74.7290596!16s%2Fg%2F11kq2kbfmw!19sChIJF1YOQy-73DsRBjEpFKeTawk?authuser=0&hl=en&rclk=1,,no,50,no,1,none_found,missing valid mobile or WhatsApp; outside target niche; rating below 4.2 or missing
Inspire Abacus Classes,Abacus classes,,,,,"4P6J VH5, Ahilyanagar - Loni - Dhanora Rd, Bishop Lloyd Colony, Ahilyanagar, Maharashtra 414003",Ahmednagar,,,https://www.google.com/maps/place/Inspire+Abacus+Classes/data=!4m7!3m6!1s0x3bdcb1acd3fbeca9:0x997f8550e5198b2d!8m2!3d19.1121353!4d74.7314816!16s%2Fg%2F11tc2dtwr6!19sChIJqez706yx3DsRLYsZ5VCFf5k?authuser=0&hl=en&rclk=1,,no,50,no,1,none_found,missing valid mobile or WhatsApp; outside target niche; rating below 4.2 or missing
Jain Abacus Coaching Classes,Abacus classes,,,,,"House no 05, Anand Nagar, Navnagapur, Ahilyanagar, Maharashtra 414005",Ahmednagar,,,https://www.google.com/maps/place/Jain+Abacus+%F0%9F%A7%AE+Coaching+Classes/data=!4m7!3m6!1s0x3bdcb1278f0392f3:0xb816adfc6050cdaf!8m2!3d19.080307!4d74.726162!16s%2Fg%2F11vxpcmdk2!19sChIJ85IDjyex3DsRr81QYPytFrg?authuser=0&hl=en&rclk=1,,no,50,no,1,none_found,missing valid mobile or WhatsApp; outside target niche; rating below 4.2 or missing
Kavita's Abacus And Phonics Classes,Abacus classes,,,,,"Chitale Rd, Sarjepura city, Ahilyanagar, Maharashtra 414001",Ahmednagar,,,https://www.google.com/maps/place/Kavita%27s+Abacus+and+Phonics+Classes/data=!4m7!3m6!1s0x3bdcb1000b019367:0x13ac9018f2cdb8aa!8m2!3d19.0971189!4d74.7344572!16s%2Fg%2F11w9yqdqnr!19sChIJZ5MBCwCx3DsRqrjN8hiQrBM?authuser=0&hl=en&rclk=1,,no,50,no,1,none_found,missing valid mobile or WhatsApp; outside target niche; rating below 4.2 or missing
Mobharkar Mh CET And Law Classes,MHT CET coaching,,,,,"Jain Sthanak, Gaikwad Mala, Savedi Rd, near Mahavir Nagar, Savedi, Ahilyanagar, Maharashtra 414003",Ahmednagar,,,https://www.google.com/maps/place/Mobharkar+MH-CET+and+Law+classes/data=!4m7!3m6!1s0x3bdcba86ce764a39:0x30575bb7e5c8b2f4!8m2!3d19.1198084!4d74.7374892!16s%2Fg%2F11xp71g5r_!19sChIJOUp2zoa63DsR9LLI5bdbVzA?authuser=0&hl=en&rclk=1,,no,50,no,1,none_found,missing valid mobile or WhatsApp; outside target niche; rating below 4.2 or missing
New Vidyasagar Coaching Classes,Tuition classes,,,,,"Sapkal hospital Chowk, maduban collany, Savedi, Ahilyanagar, Maharashtra 414003",Ahmednagar,,,https://www.google.com/maps/place/New+vidyasagar+coaching+classes/data=!4m7!3m6!1s0x3bdcbb545b5ad60f:0xc5bf729da8b5b0d9!8m2!3d19.1252724!4d74.7402827!16s%2Fg%2F11xtn4llq_!19sChIJD9ZaW1S73DsR2bC1qJ1yv8U?authuser=0&hl=en&rclk=1,,no,50,no,1,none_found,missing valid mobile or WhatsApp; outside target niche; rating below 4.2 or missing
Sai Angel's International School,English academy,,,9075199043,9075199043,"Survey No.69, 1A, Aurangabad Rd, Tavale Nagar, Ahilyanagar, Maharashtra 414003",Ahmednagar,,,https://www.google.com/maps/place/Sai+Angel%27s+International+School/data=!4m7!3m6!1s0x3bdcbabda8294107:0xfe2e124c40c8f822!8m2!3d19.1318663!4d74.755254!16s%2Fg%2F11b90cw427!19sChIJB0EpqL263DsRIvjIQEwSLv4?authuser=0&hl=en&rclk=1,,no,50,no,1,none_found,outside target niche; rating below 4.2 or missing
Sainik School Coaching Rms Coaching Gurukul Academy,Army coaching,,,,,"3PPQ H7J, Bhavani Nagar, Ahilyanagar, Maharashtra 414001",Ahmednagar,,,"https://www.google.com/maps/place/SAINIK+SCHOOL+COACHING,+RMS+COACHING-GURUKUL+ACADEMY/data=!4m7!3m6!1s0x3bdcb1a524220d73:0x868b0df76a240897!8m2!3d19.0864716!4d74.7381335!16s%2Fg%2F11spwrq6yy!19sChIJcw0iJKWx3DsRlwgkavcNi4Y?authuser=0&hl=en&rclk=1",,no,50,no,1,none_found,missing valid mobile or WhatsApp; outside target niche; rating below 4.2 or missing
Sankalp Academy Ahmednagar,Mathematics classes,,,,,"4Q97 W2M, Unnamed Road, Burhan Nagar, Ahilyanagar, Maharashtra 414003",Ahmednagar,,,"https://www.google.com/maps/place/Sankalp+Academy,+Ahmednagar/data=!4m7!3m6!1s0x3bdcbbf743ff2c53:0x95da2a5818a49c0c!8m2!3d19.1198364!4d74.7625589!16s%2Fg%2F11hks_9_fd!19sChIJUyz_Q_e73DsRDJykGFgq2pU?authuser=0&hl=en&rclk=1",,no,50,no,1,none_found,missing valid mobile or WhatsApp; outside target niche; rating below 4.2 or missing
Shree Sai Commerce Classes,Commerce classes,,,,,"4PP5 J7X, Bolhegaon Rd, Bolhegaon Suburban, Nagapur, Maharashtra 414111",Ahmednagar,,,https://www.google.com/maps/place/Shree+Sai+Commerce+Classes/data=!4m7!3m6!1s0x3bdcbb00792d1fa7:0x8cfeecd5592da61f!8m2!3d19.1366032!4d74.7082487!16s%2Fg%2F11y4rf6cp2!19sChIJpx8teQC73DsRH6YtWdXs_ow?authuser=0&hl=en&rclk=1,,no,50,no,1,none_found,missing valid mobile or WhatsApp; outside target niche; rating below 4.2 or missing
Soldiers Career Academy,Defence coaching,,,,,"3QF5 52W Soldiers Career Academy, Ahilyanagar - Solapur Rd, near Tank Museum, Darewadi, Maharashtra 414002",Ahmednagar,,,https://www.google.com/maps/place/Soldiers+Career+Academy/data=!4m7!3m6!1s0x3bdcb0358ea1e039:0xb9eadaea22bdcfa9!8m2!3d19.0729865!4d74.7575715!16s%2Fg%2F11xp7c047h!19sChIJOeChjjWw3DsRqc-9Iura6rk?authuser=0&hl=en&rclk=1,,no,50,no,1,none_found,missing valid mobile or WhatsApp; outside target niche; rating below 4.2 or missing
Speakeasy English Academy,English academy,,,,,"Bolhegaon Suburban, Nagapur, Maharashtra 414111",Ahmednagar,,,https://www.google.com/maps/place/SpeakEasy+English+Academy/data=!4m7!3m6!1s0x3bdcbb5ba0f2e58b:0x311871e91d567251!8m2!3d19.140884!4d74.7138148!16s%2Fg%2F11mrf161fj!19sChIJi-XyoFu73DsRUXJWHelxGDE?authuser=0&hl=en&rclk=1,,no,50,no,1,none_found,missing valid mobile or WhatsApp; outside target niche; rating below 4.2 or missing
Sai English Medium School,English academy,3.5,2,,,"5P73 CWV, Navnagapur, MIDC, Nagapur, Maharashtra 414111",Ahmednagar,,,https://www.google.com/maps/place/Sai+English+Medium+School/data=!4m7!3m6!1s0x3bdcbb81c5a107cd:0x47c844d20289d423!8m2!3d19.1636125!4d74.7047969!16s%2Fg%2F11rfmtl1pg!19sChIJzQehxYG73DsRI9SJAtJEyEc?authuser=0&hl=en&rclk=1,,no,45,no,1,none_found,missing valid mobile or WhatsApp; outside target niche; rating below 4.2 or missing
Aes Ashokbhau Firodiya English Medium School,English academy,,,,,"26118, Wadia Park Rd, near Shahakari Bank, Maliwada, Ahilyanagar, Maharashtra 414001",Ahmednagar,,,https://www.google.com/maps/place/AES+Ashokbhau+firodiya+English+Medium+School/data=!4m7!3m6!1s0x3bdcb170a694d3f7:0x320c85e4eb0c7e5d!8m2!3d19.0899538!4d74.734317!16s%2Fg%2F11stbk9f8t!19sChIJ99OUpnCx3DsRXX4M6-SFDDI?authuser=0&hl=en&rclk=1,,no,45,no,1,none_found,missing valid mobile or WhatsApp; outside target niche; rating below 4.2 or missing
Deccan English Medium School,English academy,,,,,"4Q63 8X3, Darga Daira, Mukundnagar, Ahilyanagar, Maharashtra 414001",Ahmednagar,,,https://www.google.com/maps/place/Deccan+English+Medium+School/data=!4m7!3m6!1s0x3bdcb0748d58bee3:0x2973fc29adfdff73!8m2!3d19.1107645!4d74.7549183!16s%2Fg%2F11ggk4qxg5!19sChIJ475YjXSw3DsRc__9rSn8cyk?authuser=0&hl=en&rclk=1,,no,45,no,1,none_found,missing valid mobile or WhatsApp; outside target niche; rating below 4.2 or missing
Inspire Abacus Class,Abacus classes,,,,,"Ward No 12, A Shiradhon, 577, behind Sarda Collegea, Samata Nagar, Ahilyanagar, Maharashtra 414001",Ahmednagar,,,https://www.google.com/maps/place/Inspire+Abacus+Class/data=!4m7!3m6!1s0x3bdcb139679d9a83:0xdcb06cb822cd83fe!8m2!3d19.0918995!4d74.7192594!16s%2Fg%2F11vj9rqrn0!19sChIJg5qdZzmx3DsR_oPNIrhssNw?authuser=0&hl=en&rclk=1,,no,45,no,1,none_found,missing valid mobile or WhatsApp; outside target niche; rating below 4.2 or missing
Inspire Abacus Class Vinayak Nagar Ahmednagar,Abacus classes,,,,,"Anand Baug, Pundalik Nager, Vinayak Nagar, Ahilyanagar, Maharashtra 414001",Ahmednagar,,,https://www.google.com/maps/place/Inspire+Abacus+class+Vinayak+nagar+Ahmednagar/data=!4m7!3m6!1s0x3bdcb16ad3976093:0xae42d1893aed3285!8m2!3d19.0736426!4d74.7343647!16s%2Fg%2F11l71dcvpc!19sChIJk2CX02qx3DsRhTLtOonRQq4?authuser=0&hl=en&rclk=1,,no,45,no,1,none_found,missing valid mobile or WhatsApp; outside target niche; rating below 4.2 or missing
