business_name,niche,phone,whatsapp,rating,reviews,website_status,branch_signal,digital_score,priority_score,maps_link,district,city,website,short_address,taluka
Rai Education NEET JEE Foundation Classes In Beed,"IIT JEE, NEET, 11th 12th Science",9852983333,9852983333,4.9,48,weak_website,single_location,85,100,https://www.google.com/maps/place/Rai Education- NEET JEE FOUNDATION Classes in Beed/data=!4m7!3m6!1s0x4665d7b5f829a43f:0x20835edfb277ae1f!8m2!3d18.9937194!4d75.7508093!16s/g/11vz6hwy45!19sChIJP6Qp-LXXZUYRH653st9egyA,Beed,,https://instagram.com,"Kranti Nagar, Beed",
Physics Wallah Vidyapeeth Pathshala Coaching Center Beed 8th 12th IIT JEE NEET And Dropper MHT CET,"IIT JEE, NEET, 11th 12th Science, MHT-CET, CET",7428096975,7428096975,4.6,28,active_website,multiple_branches,70,100,"https://www.google.com/maps/place/Physics Wallah Vidyapeeth Pathshala Coaching Center Beed (8th-12th ) IIT-JEE,NEET and Dropper MHT-CET/data=!4m7!3m6!1s0x3bc52b0cb6590c13:0xc283b9d1a6163b3e!8m2!3d19.0018642!4d75.7487429!16s/g/11yb171lfk!19sChIJEwxZtgwrxTsRPjsWptG5g8I",Beed,,https://pw.live,"Shivrana Nagar, Beed",
Biyani Digital Smart Coaching,CET,8600555689,8600555689,4.6,102,no_website,single_location,95,85,https://www.google.com/maps/place/Biyani Digital Smart Coaching/data=!4m7!3m6!1s0x3bc52ad905ff01fd:0xfd8b3a7f02523b2a!8m2!3d18.996515!4d75.756584!16s/g/11g6qdjjd2!19sChIJ_QH_BdkqxTsRKjtSAn86i_0,Beed,,,"Shivaji Maharaj Stadium, Beed",
MPSC Coaching,MPSC,9689665611,9689665611,,,no_website,single_location,70,85,https://www.google.com/maps/place/Mpsc Coaching/data=!4m7!3m6!1s0x3bc52b564a6bcc23:0xcb4f4cd7ed6a4086!8m2!3d18.990088!4d75.7531324!16s/g/11rwkyv_7w!19sChIJI8xrSlYrxTsRhkBq7ddMT8s,Beed,,,"Nathapur, Beed",
Sankalp Coaching Classes& Abacus Centre Beed,CET,9766574882,9766574882,,,no_website,multiple_branches,70,60,https://www.google.com/maps/place/Sankalp Coaching Classes& Abacus Centre Beed/data=!4m7!3m6!1s0x3bc52bd848c11309:0x708d782600f605df!8m2!3d18.9802368!4d75.7414721!16s/g/11y30_l72f!19sChIJCRPBSNgrxTsR3wX2ACZ4jXA,Beed,,,"Sant Namdev Nagar, Beed",
